<?xml version="1.0" encoding="UTF-8"?>
<xsd:schema
        xmlns:xsd="http://www.w3.org/2001/XMLSchema">
    <xsd:include schemaLocation=""></xsd:include>
    <xsd:annotation>
        <xsd:documentation xml:lang="en">Candy schema.
        </xsd:documentation>
    </xsd:annotation>

    <xsd:element name="candies" type="Candies"></xsd:element>
    <xsd:complexType name="Candies">
        <xsd:sequence>
            <xsd:element ref="candy" minOccurs="0" maxOccurs="unbounded"></xsd:element>
        </xsd:sequence>
    </xsd:complexType>

    <xsd:element name="candy" type="CandyType"/>
    <xsd:complexType name="CandyType">
        <xsd:sequence>
            <xsd:element name="energy" type="QuantityType"/>
            <xsd:element name="type" type="TypeType"/>
            <xsd:element name="ingredients" type="IngredientsType"/>
            <xsd:element name="value" type="ValueType"/>
            <xsd:element name="production" type="xsd:string"/>
            <xsd:element name="description" type="xsd:string" minOccurs="0" maxOccurs="1"/>
        </xsd:sequence>
        <xsd:attribute name="name" type="nameAttribType"/>
    </xsd:complexType>

    <xsd:simpleType name="nameAttribType">
        <xsd:restriction base="xsd:string">
            <xsd:pattern value="[A-Za-z]+"/>
        </xsd:restriction>
    </xsd:simpleType>

    <xsd:complexType name="TypeType">
        <xsd:simpleContent>
            <xsd:extension base="TypeNameType">
                <xsd:attribute name="filling" type="xsd:boolean" use="optional"/>
            </xsd:extension>
        </xsd:simpleContent>
    </xsd:complexType>

    <xsd:simpleType name="TypeNameType">
        <xsd:restriction base="xsd:string">
            <xsd:enumeration value="Chocolate"/>
            <xsd:enumeration value="Caramel"/>
            <xsd:enumeration value="Iris"/>
            <xsd:enumeration value="Chocolate with filling"/>
        </xsd:restriction>
    </xsd:simpleType>

    <xsd:complexType name="IngredientsType">
        <xsd:sequence>
            <xsd:element name="ingredient" type="IngredientType" minOccurs="0" maxOccurs="unbounded"/>
        </xsd:sequence>
    </xsd:complexType>

    <xsd:complexType name="IngredientType">
        <xsd:sequence>
            <xsd:element name="name" type="xsd:string"/>
            <xsd:element name="quantity" type="QuantityType"/>
        </xsd:sequence>
    </xsd:complexType>

    <xsd:simpleType name="QuantityType">
        <xsd:restriction base="xsd:nonNegativeInteger">
            <xsd:maxInclusive value="10000"/>
        </xsd:restriction>
    </xsd:simpleType>

    <xsd:complexType name="ValueType">
        <xsd:sequence>
            <xsd:element name="proteins" type="QuantityType"/>
            <xsd:element name="fats" type="QuantityType"/>
            <xsd:element name="carbohydrates" type="QuantityType"/>
        </xsd:sequence>
    </xsd:complexType>
</xsd:schema>

