<?xml version="1.0" encoding="UTF-8"?>
<candies xmlns:xsi="http://www.w3.org/2001/XMLSchema-instance" xsi:noNamespaceSchemaLocation="candy.xsd">
    <candy name="Duchess">
        <energy>299</energy>
        <type>Caramel</type>
        <ingredients>
            <ingredient>
                <name>Water</name>
                <quantity>115</quantity>
            </ingredient>
            <ingredient>
                <name>Salt</name>
                <quantity>1</quantity>
            </ingredient>
            <ingredient>
                <name>Sugar</name>
                <quantity>98</quantity>
            </ingredient>
        </ingredients>
        <value>
            <proteins>17</proteins>
            <fats>30</fats>
            <carbohydrates>48</carbohydrates>
        </value>
        <production>Roshen</production>
        <description>Good taste</description>
    </candy>

    <candy name="RoyalCharm">
        <energy>308</energy>
        <type filling="true">Chocolate with filling</type>
        <ingredients>
            <ingredient>
                <name>Water</name>
                <quantity>108</quantity>
            </ingredient>
            <ingredient>
                <name>Salt</name>
                <quantity>2</quantity>
            </ingredient>
            <ingredient>
                <name>Sugar</name>
                <quantity>98</quantity>
            </ingredient>
        </ingredients>
        <value>
            <proteins>5</proteins>
            <fats>35</fats>
            <carbohydrates>55</carbohydrates>
        </value>
        <production>AVK</production>
        <description>Wonderful taste</description>
    </candy>

    <candy name="DeLux">
        <energy>299</energy>
        <type filling="true">Chocolate with filling</type>
        <ingredients>
            <ingredient>
                <name>Water</name>
                <quantity>170</quantity>
            </ingredient>
            <ingredient>
                <name>Salt</name>
                <quantity>3</quantity>
            </ingredient>
            <ingredient>
                <name>Sugar</name>
                <quantity>168</quantity>
            </ingredient>
        </ingredients>
        <value>
            <proteins>7</proteins>
            <fats>27</fats>
            <carbohydrates>51</carbohydrates>
        </value>
        <production>Korona</production>
        <description>Wonderful taste</description>
    </candy>

    <candy name="Romashka">
        <energy>270</energy>
        <type filling="false">Chocolate</type>
        <ingredients>
            <ingredient>
                <name>Water</name>
                <quantity>95</quantity>
            </ingredient>
            <ingredient>
                <name>Salt</name>
                <quantity>1</quantity>
            </ingredient>
            <ingredient>
                <name>Sugar</name>
                <quantity>98</quantity>
            </ingredient>
        </ingredients>
        <value>
            <proteins>6</proteins>
            <fats>30</fats>
            <carbohydrates>52</carbohydrates>
        </value>
        <production>Svitoch</production>
        <description>Goog taste</description>
    </candy>
</candies>